question,groundtruth_answer,actual_answer,response_time_s,use_reranker,top_k_rank
What are the key differences between `CodeAgent` and `ReactAgent`?,"The key differences between `CodeAgent` and `ReactAgent` are:  
   
1. **Execution Method**:  
   - `CodeAgent`: Executes in one shot. It generates the code to solve the task and executes it all at once.  
   - `ReactAgent`: Operates step by step. Each step consists of one thought, followed by one tool call and execution.  
   
2. **Types of `ReactAgent`**:  
   - `ReactJsonAgent`: Writes its tool calls in JSON.  
   - `ReactCodeAgent`: Writes its tool calls in Python code.   
  
These differences highlight the approach and granularity with which each agent type handles tasks and tool executions.","The key differences between `CodeAgent` and `ReactAgent` are as follows:

1. **Execution Style**:
   - **CodeAgent**: Acts in one shot by generating code to solve the task and then executes it all at once.
   - **ReactAgent**: Acts step by step. Each step consists of a thought process, followed by a tool call and execution.

2. **Types of React Agents**:
   - The `ReactAgent` has two specific classes: 
     - **ReactJsonAgent**: Writes tool calls in JSON format.
     - **ReactCodeAgent**: Writes tool calls in Python code.

3. **Task Handling**:
   - **CodeAgent**: Designed for tasks where it is efficient to generate and execute a complete code solution in a single step.
   - **ReactAgent**: More suited for reasoning tasks where the agent needs to build upon observations iteratively, allowing for dynamic adjustments based on intermediate outcomes.

4. **Planning and Execution**:
   - **CodeAgent**: No intermediate observations; it completes the planning and execution in a single go.
   - **ReactAgent**: Involves a cycle of 'Thought:', 'Code:', and 'Observation:' sequences, allowing it to plan and execute actions one at a time while using previous observations for contextual information.

These differences show how each agent type is tailored for specific types of tasks, either processing everything in one shot or taking a more iterative and adaptive approach.",29.66740322113037,True,7
How does the `generate` method work in different modalities?,"The `generate` method works differently in various modalities by relying on the specific inputs provided by the model's preprocessor class. The inputs to the `generate` method depend on the model's modality, and they are returned by the model's preprocessor class, such as `AutoTokenizer` or `AutoProcessor`. If a model's preprocessor creates more than one kind of input, all the inputs should be passed to the `generate` method. This ensures that the method can produce appropriate text outputs for different tasks, such as text summarization, image captioning, and audio transcription.","The documents provided do not specifically address how the `generate` method works in different modalities. They mainly focus on the generation process in text-based tasks, particularly with language models like GPT-J and GPT-2. Therefore, I don't know how the `generate` method operates in other modalities beyond the text generation context given.",25.572176933288574,True,7
How can one load a fine-tuned model of DiT from the hub for document image classification?,"You can load a fine-tuned model of DiT from the hub for document image classification using the following code:  
   
```python  
from transformers import AutoModelForImageClassification  
model = AutoModelForImageClassification.from_pretrained(""microsoft/dit-base-finetuned-rvlcdip"")  
```  
   
This particular checkpoint was fine-tuned on RVL-CDIP, an important benchmark for document image classification.","You can load a fine-tuned model of DiT from the hub for document image classification by using the following code:

```python
from transformers import AutoModelForImageClassification

model = AutoModelForImageClassification.from_pretrained(""microsoft/dit-base-finetuned-rvlcdip"")
```

This loads the fine-tuned model that has been specifically trained on the RVL-CDIP benchmark for document image classification.",28.664664030075073,True,7
How does the tokenization procedure impact a model's perplexity?,"The tokenization procedure has a direct impact on a model's perplexity because perplexity is defined as the exponentiated average negative log-likelihood of a sequence. Since the log-likelihood is calculated for each token in the sequence, the way the sequence is tokenized will affect the likelihoods and thus the perplexity. This should always be taken into consideration when comparing different models.","The tokenization procedure directly impacts a model's perplexity because it affects how the input sequence is represented and, consequently, how well the model can predict the next tokens in the sequence. Perplexity is defined as the exponentiated average negative log-likelihood of a sequence, which involves calculating the likelihood of each token conditioned on the preceding tokens. 

If the tokenization method leads to a greater number of tokens (for example, using character-level tokenization instead of word or subword tokenization), it may increase the complexity of learning meaningful representations, thus potentially resulting in poorer predictions. This can elevate the perplexity value, indicating a less effective model.

Conversely, a more effective tokenization strategy, such as subword tokenization, balances the representation of common word forms and rare or new words, thus potentially allowing the model to better predict the next token and reduce perplexity. Therefore, the choice of tokenization technique is crucial and should be carefully considered when evaluating and comparing different language models.",27.099846124649048,True,7
What change has been made regarding Falcon models on the Hugging Face Hub?,"Falcon models were initially added to the Hugging Face Hub as custom code checkpoints. However, Falcon is now fully supported in the Transformers library.","Falcon models were initially added to the Hugging Face Hub as custom code checkpoints. However, Falcon is now fully supported in the Transformers library. It is recommended to convert custom checkpoints to the new in-library format, as this provides significant improvements to stability and performance, especially for generation, and removes the need to use trust_remote_code=True.",21.64090323448181,True,7
Why doesn't AWQ quantize all the weights in a model?,AWQ doesn't quantize all the weights in a model because it preserves a small percentage of weights that are important for LLM performance. This significantly reduces quantization loss such that you can run models in 4-bit precision without experiencing any performance degradation.,"AWQ (Activation-aware Weight Quantization) doesn't quantize all the weights in a model because it aims to preserve a small percentage of weights that are important for the performance of large language models (LLMs). By doing this, AWQ significantly reduces quantization loss, allowing models to run in lower precision, such as 4-bit, without experiencing any degradation in performance.",29.38857412338257,True,7
How is the performance of the distilled model evaluated?,"The performance of the distilled model is evaluated using the compute_metrics function, which computes the accuracy and F1 score of the model on the test set. Specifically, the accuracy is calculated by comparing the model's predictions to the true labels. During the training process, this function is used to assess the model's performance, and the final evaluation is conducted on the test set using the trainer.evaluate(processed_datasets[""test""]) method. The distilled model achieved 72 percent accuracy on the test set.","The performance of the distilled model is evaluated on a test set, as indicated by using the `trainer.evaluate(processed_datasets[""test""])` function. In the context provided, the model reached 72 percent accuracy on the test set. This evaluation provides a measure of how well the distilled model performs compared to, for example, a model trained from scratch, which in this case achieved 63 percent accuracy on the same dataset.",28.159291982650757,True,7
What is Grouped Query Attention and how is it used in StarCoder2?,"Grouped Query Attention is a technique used in the StarCoder2 models. All models in the StarCoder2 family utilize this technique, although the text does not provide detailed specifics on its implementation or functionality.","Grouped Query Attention (GQA) is a mechanism used in attention models to efficiently manage the attention heads and enhance performance, particularly in large language models (LLMs). GQA works by grouping the queries and their corresponding key-value pairs, allowing the model to leverage a reduced number of key-value heads while maintaining effective attention to the input sequences.

In StarCoder2, GQA is implemented as a part of its architecture, where it utilizes this mechanism to optimize memory usage and computational efficiency during inference. Specifically, StarCoder2 employs GQA alongside a context window of 16,384 tokens and a sliding window attention of 4,096 tokens, enabling the model to handle long input contexts more effectively. The architecture benefits from such innovations, making it well-suited for tasks related to coding, as it has been trained on a large dataset encompassing various programming languages and code-related tasks.",28.885493993759155,True,7
What temperature range is considered good for a GPU under heavy load?,"'s hard to tell the exact best temperature to strive for when a GPU is heavily loaded, but probably anything under +80C is good, but lower is better - perhaps 70-75C is an excellent range to be in.","A good temperature range for a GPU under heavy load is probably anything under 80°C, but lower is better – perhaps 70-75°C is considered an excellent range to be in. Throttling down is likely to start at around 84-90°C.",26.531076908111572,True,7
What is LSH attention and how does it work in the Reformer model?,"LSH attention in the Reformer model works by focusing only on the largest elements in the softmax(QK^t) matrix, which are the most useful contributions. For each query  q in Q , only the keys  k  in K  that are close to  q  are considered. A hash function is used to determine if q  and k  are close. The attention mask is modified to mask the current token (except at the first position) to prevent the query and key from being equal. Since the hash can be somewhat random, several hash functions (determined by a n_rounds parameter) are used and averaged together.","LSH (Locality-Sensitive Hashing) attention is an efficient attention mechanism used in the Reformer model to address the computational bottleneck associated with full attention, especially in scenarios involving long texts. 

In traditional attention, the attention matrix is square and scales quadratically with the sequence length, which can be computationally heavy. LSH attention modifies this approach by focusing only on the most relevant keys for each query.

Here's how LSH attention works in the Reformer model:

1. **Hashing**: For each query vector \( q \) in the set of queries \( Q \), a hash function is applied to identify keys \( k \) in the set of keys \( K \) that are close to \( q \). The hash function maps the queries and keys into buckets such that nearby items are likely to hash to the same bucket.

2. **Selecting Keys**: Instead of computing the full dot-product attention scores with every key, LSH attention restricts the attention to only those keys that fall within the same hash bucket as the query. This significantly reduces the number of key comparisons needed to compute the attention scores.

3. **Attention Calculation**: The attention mechanism then computes the softmax over the selected keys based on their relevance to the query, effectively focusing only on a subset of keys rather than the entire key set. This leads to faster computations and reduced memory usage.

4. **Masking**: Additionally, the attention mask is modified to prevent a token from attending to itself (except for the first position), maintaining the autoregressive property.

Overall, LSH attention provides a way to achieve self-attention that is more memory-efficient and faster, especially for long sequences, by only considering a subset of keys related to each query rather than the entire set.",30.717530012130737,True,7
